[
  {
    "id": "C001",
    "名称": "林舟",
    "名称类型": "姓名",
    "状态": "已确认",
    "别名称呼": [],
    "外观": [
      {
        "集": 1,
        "描述": "林舟",
        "参考帧": "E01/素材/frames/K001_01.jpg"
      }
    ],
    "声线": [
      {
        "集": 1,
        "标签": "E01-V1",
        "特征": "声音清楚",
        "依据": "测试夹具"
      }
    ],
    "关系": [],
    "身份依据": [
      "测试夹具"
    ],
    "性格总结": [],
    "首次出场": "E01-K001",
    "待核对": []
  },
  {
    "id": "C002",
    "名称": "沈宁",
    "名称类型": "姓名",
    "状态": "已确认",
    "别名称呼": [],
    "外观": [
      {
        "集": 1,
        "描述": "沈宁",
        "参考帧": "E01/素材/frames/K003_01.jpg"
      }
    ],
    "声线": [
      {
        "集": 1,
        "标签": "E01-V2",
        "特征": "声音清楚",
        "依据": "测试夹具"
      }
    ],
    "关系": [],
    "身份依据": [
      "测试夹具"
    ],
    "性格总结": [],
    "首次出场": "E01-K003",
    "待核对": []
  },
  {
    "id": "C003",
    "名称": "穿红衣服的小男孩",
    "名称类型": "描述名",
    "状态": "已确认",
    "别名称呼": [],
    "外观": [
      {
        "集": 1,
        "描述": "穿红衣服的小男孩",
        "参考帧": "E01/素材/frames/K004_01.jpg"
      }
    ],
    "声线": [],
    "关系": [],
    "身份依据": [
      "测试夹具"
    ],
    "性格总结": [],
    "首次出场": "E01-K004",
    "待核对": []
  }
]
