[
  {
    "id": "C001",
    "名称": "林舟",
    "名称类型": "姓名",
    "状态": "已确认",
    "别名称呼": [],
    "外观": [
      {
        "集": 1,
        "描述": "黑色西装、短发",
        "参考帧": "E01/素材/frames/K001_01.jpg"
      }
    ],
    "声线": [
      {
        "集": 1,
        "标签": "E01-V1",
        "特征": "测试声线",
        "依据": "人工测试对白"
      }
    ],
    "关系": [],
    "身份依据": [
      "人工测试数据"
    ],
    "性格总结": [],
    "首次出场": "E01-K001",
    "待核对": []
  },
  {
    "id": "C002",
    "名称": "沈宁",
    "名称类型": "姓名",
    "状态": "已确认",
    "别名称呼": [],
    "外观": [
      {
        "集": 1,
        "描述": "白衬衫、长发",
        "参考帧": "E01/素材/frames/K002_01.jpg"
      }
    ],
    "声线": [
      {
        "集": 1,
        "标签": "E01-V2",
        "特征": "测试声线",
        "依据": "人工测试对白"
      }
    ],
    "关系": [],
    "身份依据": [
      "人工测试数据"
    ],
    "性格总结": [],
    "首次出场": "E01-K002",
    "待核对": []
  }
]
